{"cases":[{"case_id":"c000","description":"Zero — no set bits","expected":{"literal":0},"input":{"n":0},"tags":["edge"],"time_class":"standard","visibility":"visible"},{"case_id":"c001","description":"Single LSB","expected":{"literal":1},"input":{"n":1},"tags":["edge"],"time_class":"standard","visibility":"visible"},{"case_id":"c002","description":"0b1011 has three set bits (LeetCode example)","expected":{"literal":3},"input":{"n":11},"tags":["basic"],"time_class":"standard","visibility":"visible"},{"case_id":"c003","description":"Power of two — 0b10000000, one set bit (LeetCode example)","expected":{"literal":1},"input":{"n":128},"tags":["basic"],"time_class":"standard","visibility":"visible"},{"case_id":"c004","description":"0b10 — one set bit","expected":{"literal":1},"input":{"n":2},"tags":["edge"],"time_class":"standard","visibility":"visible"},{"case_id":"c005","description":"0b111 — three contiguous set bits","expected":{"literal":3},"input":{"n":7},"tags":["basic"],"time_class":"standard","visibility":"visible"},{"case_id":"c006","description":"2^16 — one set bit at position 16","expected":{"literal":1},"input":{"n":65536},"tags":["basic"],"time_class":"standard","visibility":"visible"},{"case_id":"c007","description":"2^31 - 1 — all 31 low bits set (Java Integer.MAX_VALUE)","expected":{"literal":31},"input":{"n":2147483647},"tags":["large"],"time_class":"large","visibility":"visible"},{"case_id":"c008","description":"0xFFFFFFFD — 32-bit all-ones with bit 1 cleared (LeetCode signed-edge case)","expected":{"literal":31},"input":{"n":4294967293},"tags":["large"],"time_class":"large","visibility":"visible"}],"content_version":1,"entry":{"kind":"function","name":"hamming_weight","params":[{"name":"n","type":"any"}],"returns":"any"},"schema":"test-definition/v1","slug":"number-of-1-bits","track":"coding","validators":null,"variant":"python"}