{"cases":[{"case_id":"c000","description":"Standard example","expected":{"literal":[1,1,1,2,1,4,6]},"input":{"prices":[8,6,2,4,2,5,7]},"tags":["basic"],"time_class":"standard","visibility":"visible"},{"case_id":"c001","description":"Classic stock span example","expected":{"literal":[1,1,2,1,4,5]},"input":{"prices":[100,60,70,65,80,85]},"tags":["basic"],"time_class":"standard","visibility":"visible"},{"case_id":"c002","description":"Strictly increasing","expected":{"literal":[1,2,3,4]},"input":{"prices":[10,20,30,40]},"tags":["edge"],"time_class":"standard","visibility":"visible"},{"case_id":"c003","description":"Strictly decreasing","expected":{"literal":[1,1,1,1]},"input":{"prices":[40,30,20,10]},"tags":["edge"],"time_class":"standard","visibility":"visible"},{"case_id":"c004","description":"Equal prices count in the span","expected":{"literal":[1,2,3]},"input":{"prices":[5,5,5]},"tags":["tricky"],"time_class":"standard","visibility":"visible"},{"case_id":"c005","description":"Empty input","expected":{"literal":[]},"input":{"prices":[]},"tags":["edge"],"time_class":"standard","visibility":"visible"}],"content_version":1,"entry":{"kind":"function","name":"stock_span","params":[{"name":"prices","type":"any"}],"returns":"any"},"schema":"test-definition/v1","slug":"stock-span","track":"coding","validators":null,"variant":"python"}