{"cases":[{"case_id":"c000","description":"Small package fits S1 first","expected":{"literal":[null,"S1","S1"]},"input":{"args":[[[["S","S1",2,2],["M","M1",5,3],["L","L1",10,8]]],["p1",1,1],["p1"]],"ops":["LockerLocation","put","get"]},"tags":["basic"],"time_class":"standard","visibility":"visible"},{"case_id":"c001","description":"Package too big for S — fits M","expected":{"literal":[null,"M1"]},"input":{"args":[[[["S","S1",2,2],["M","M1",5,3]]],["p1",4,3]],"ops":["LockerLocation","put"]},"tags":["basic"],"time_class":"standard","visibility":"visible"},{"case_id":"c002","description":"Package larger than every locker","expected":{"literal":[null,null]},"input":{"args":[[[["S","S1",2,2]]],["p1",5,5]],"ops":["LockerLocation","put"]},"tags":["edge"],"time_class":"standard","visibility":"visible"},{"case_id":"c003","description":"Two packages fill two S lockers (either ordering valid)","expected":{"matcher":"any_of","values":[[null,"S1","S2"],[null,"S2","S1"]]},"input":{"args":[[[["S","S1",2,2],["S","S2",2,2]]],["p1",1,1],["p2",1,1]],"ops":["LockerLocation","put","put"]},"tags":["basic"],"time_class":"standard","visibility":"visible"},{"case_id":"c004","description":"Single S, second put has no room","expected":{"literal":[null,"S1",null,null]},"input":{"args":[[[["S","S1",2,2]]],["p1",1,1],["p2",1,1],["p3",1,1]],"ops":["LockerLocation","put","put","put"]},"tags":["edge"],"time_class":"standard","visibility":"visible"},{"case_id":"c005","description":"Rotation — 2x5 package fits in 5x3 locker rotated","expected":{"literal":[null,"M1"]},"input":{"args":[[[["M","M1",5,3]]],["p1",2,5]],"ops":["LockerLocation","put"]},"tags":["basic"],"time_class":"standard","visibility":"visible"},{"case_id":"c006","description":"get on unknown package","expected":{"literal":[null,null]},"input":{"args":[[[["S","S1",2,2]]],["p_unknown"]],"ops":["LockerLocation","get"]},"tags":["edge"],"time_class":"standard","visibility":"visible"}],"content_version":1,"entry":{"class":"LockerLocation","constructor":{"params":[{"name":"lockers","type":"any[]"}]},"kind":"class_ops","methods":[{"name":"put","params":[{"name":"package_id","type":"string"},{"name":"width","type":"int"},{"name":"length","type":"int"}],"returns":"any"},{"name":"get","params":[{"name":"package_id","type":"string"}],"returns":"any"}]},"schema":"test-definition/v1","slug":"amazon-locker-package-fit","track":"coding","validators":null,"variant":"python"}