{"cases":[{"case_id":"c000","description":"Simplest two-operand addition","expected":{"literal":3},"input":{"tokens":["2","1","+"]},"tags":["basic"],"time_class":"standard","visibility":"visible"},{"case_id":"c001","description":"(2 + 1) * 3 — example 1","expected":{"literal":9},"input":{"tokens":["2","1","+","3","*"]},"tags":["basic"],"time_class":"standard","visibility":"visible"},{"case_id":"c002","description":"4 + (13 / 5) = 4 + 2 = 6","expected":{"literal":6},"input":{"tokens":["4","13","5","/","+"]},"tags":["basic"],"time_class":"standard","visibility":"visible"},{"case_id":"c003","description":"Full LeetCode example with negative token and nested division","expected":{"literal":22},"input":{"tokens":["10","6","9","3","+","-11","*","/","*","17","+","5","+"]},"tags":["complex"],"time_class":"standard","visibility":"visible"},{"case_id":"c004","description":"Single number — no operators applied","expected":{"literal":42},"input":{"tokens":["42"]},"tags":["edge"],"time_class":"standard","visibility":"visible"},{"case_id":"c005","description":"Single negative number","expected":{"literal":-5},"input":{"tokens":["-5"]},"tags":["edge"],"time_class":"standard","visibility":"visible"},{"case_id":"c006","description":"Subtraction yielding negative result (3 - 5)","expected":{"literal":-2},"input":{"tokens":["3","5","-"]},"tags":["edge"],"time_class":"standard","visibility":"visible"},{"case_id":"c007","description":"Division truncates toward zero — 7 / -3 = -2 (NOT -3 from floor)","expected":{"literal":-2},"input":{"tokens":["7","-3","/"]},"tags":["tricky"],"time_class":"standard","visibility":"visible"},{"case_id":"c008","description":"Truncation again — -7 / 3 = -2 (floor would give -3)","expected":{"literal":-2},"input":{"tokens":["-7","3","/"]},"tags":["tricky"],"time_class":"standard","visibility":"visible"},{"case_id":"c009","description":"Zero result from subtraction","expected":{"literal":0},"input":{"tokens":["5","5","-"]},"tags":["edge"],"time_class":"standard","visibility":"visible"},{"case_id":"c010","description":"Mixed operators — (2*3) + (4*5) = 6 + 20","expected":{"literal":26},"input":{"tokens":["2","3","*","4","5","*","+"]},"tags":["basic"],"time_class":"standard","visibility":"visible"},{"case_id":"c011","description":"Deeply nested left-associative addition","expected":{"literal":15},"input":{"tokens":["1","2","+","3","+","4","+","5","+"]},"tags":["tricky"],"time_class":"standard","visibility":"visible"},{"case_id":"c012","description":"Mixed operators with division — ((100+200)/2)*5 + 7","expected":{"literal":757},"input":{"tokens":["100","200","+","2","/","5","*","7","+"]},"tags":["complex"],"time_class":"standard","visibility":"visible"}],"content_version":1,"entry":{"kind":"function","name":"eval_rpn","params":[{"name":"tokens","type":"any"}],"returns":"any"},"schema":"test-definition/v1","slug":"evaluate-reverse-polish-notation","track":"coding","validators":null,"variant":"python"}