{"cases":[{"case_id":"c000","description":"Two courses, single edge — only [0,1] is valid","expected":{"validator_id":"v-d1eb6af81b93"},"input":{"num_courses":2,"prerequisites":[[1,0]]},"tags":["basic"],"time_class":"standard","visibility":"visible"},{"case_id":"c001","description":"Diamond DAG — multiple valid orderings (e.g. [0,1,2,3] or [0,2,1,3])","expected":{"validator_id":"v-d1eb6af81b93"},"input":{"num_courses":4,"prerequisites":[[1,0],[2,0],[3,1],[3,2]]},"tags":["basic"],"time_class":"standard","visibility":"visible"},{"case_id":"c002","description":"Single course, no prereqs — uniquely [0]","expected":{"literal":[0]},"input":{"num_courses":1,"prerequisites":[]},"tags":["edge"],"time_class":"standard","visibility":"visible"},{"case_id":"c003","description":"Zero courses — empty order","expected":{"literal":[]},"input":{"num_courses":0,"prerequisites":[]},"tags":["edge"],"time_class":"standard","visibility":"visible"},{"case_id":"c004","description":"Two-node cycle — impossible, return []","expected":{"literal":[]},"input":{"num_courses":2,"prerequisites":[[1,0],[0,1]]},"tags":["edge"],"time_class":"standard","visibility":"visible"},{"case_id":"c005","description":"Three-node cycle — impossible, return []","expected":{"literal":[]},"input":{"num_courses":3,"prerequisites":[[0,1],[1,2],[2,0]]},"tags":["tricky"],"time_class":"standard","visibility":"visible"},{"case_id":"c006","description":"Linear chain — uniquely ordered","expected":{"literal":[0,1,2,3,4,5]},"input":{"num_courses":6,"prerequisites":[[1,0],[2,1],[3,2],[4,3],[5,4]]},"tags":["tricky"],"time_class":"standard","visibility":"visible"},{"case_id":"c007","description":"Five disconnected courses — any permutation is valid","expected":{"validator_id":"v-d1eb6af81b93"},"input":{"num_courses":5,"prerequisites":[]},"tags":["edge"],"time_class":"standard","visibility":"visible"}],"content_version":1,"entry":{"kind":"function","name":"find_order","params":[{"name":"num_courses","type":"any"},{"name":"prerequisites","type":"any"}],"returns":"any"},"schema":"test-definition/v1","slug":"course-schedule-ii","track":"coding","validators":{"checksum":"sha256:a6d7e42127dde80e1b67bb3f2d00d1bc1c523f3092ae8844ed4c4260508af7b9","content_version":1,"slug":"course-schedule-ii"},"variant":"javascript"}