{"cases":[{"case_id":"c000","description":"Standard canonical example","expected":{"literal":6},"input":{"heights":[0,1,0,2,1,0,1,3,2,1,2,1]},"tags":["basic"],"time_class":"standard","visibility":"visible"},{"case_id":"c001","description":"Empty","expected":{"literal":0},"input":{"heights":[]},"tags":["edge"],"time_class":"standard","visibility":"visible"},{"case_id":"c002","description":"Single bar — no water possible","expected":{"literal":0},"input":{"heights":[3]},"tags":["edge"],"time_class":"standard","visibility":"visible"},{"case_id":"c003","description":"Monotonic ascending — water flows off the right","expected":{"literal":0},"input":{"heights":[1,2,3,4]},"tags":["edge"],"time_class":"standard","visibility":"visible"},{"case_id":"c004","description":"Monotonic descending — water flows off the left","expected":{"literal":0},"input":{"heights":[4,3,2,1]},"tags":["edge"],"time_class":"standard","visibility":"visible"},{"case_id":"c005","description":"Single trough","expected":{"literal":2},"input":{"heights":[2,0,2]},"tags":["basic"],"time_class":"standard","visibility":"visible"},{"case_id":"c006","description":"Flat plateau — no trapping","expected":{"literal":0},"input":{"heights":[3,3,3]},"tags":["edge"],"time_class":"standard","visibility":"visible"},{"case_id":"c007","description":"Tricky asymmetric profile","expected":{"literal":9},"input":{"heights":[4,2,0,3,2,5]},"tags":["tricky"],"time_class":"standard","visibility":"visible"}],"content_version":1,"entry":{"kind":"function","name":"trap","params":[{"name":"heights","type":"any"}],"returns":"any"},"schema":"test-definition/v1","slug":"falling-water-trapping-rain-water","track":"coding","validators":null,"variant":"python"}