{"cases":[{"case_id":"c000","description":"Classic LeetCode example — three partitions","expected":{"literal":[9,7,8]},"input":{"s":"ababcbacadefegdehijhklij"},"tags":["basic"],"time_class":"standard","visibility":"visible"},{"case_id":"c001","description":"Second LeetCode example — entire string is one partition","expected":{"literal":[10]},"input":{"s":"eccbbbbdec"},"tags":["basic"],"time_class":"standard","visibility":"visible"},{"case_id":"c002","description":"Single character","expected":{"literal":[1]},"input":{"s":"a"},"tags":["edge"],"time_class":"standard","visibility":"visible"},{"case_id":"c003","description":"All same character — one partition","expected":{"literal":[6]},"input":{"s":"aaaaaa"},"tags":["edge"],"time_class":"standard","visibility":"visible"},{"case_id":"c004","description":"All distinct chars — every char is its own part","expected":{"literal":[1,1,1,1,1,1]},"input":{"s":"abcdef"},"tags":["edge"],"time_class":"standard","visibility":"visible"},{"case_id":"c005","description":"Three non-overlapping pairs — three parts","expected":{"literal":[2,2,2]},"input":{"s":"aabbcc"},"tags":["basic"],"time_class":"standard","visibility":"visible"},{"case_id":"c006","description":"Nested overlap — every letter spans the whole string","expected":{"literal":[6]},"input":{"s":"abcabc"},"tags":["tricky"],"time_class":"standard","visibility":"visible"},{"case_id":"c007","description":"First three chars share `a`; last four interleave `d` and `c`","expected":{"literal":[3,4]},"input":{"s":"abadcdc"},"tags":["tricky"],"time_class":"standard","visibility":"visible"},{"case_id":"c008","description":"Long-overlap window followed by two singletons","expected":{"literal":[13,1,1]},"input":{"s":"qiejxqfnqceocmy"},"tags":["tricky"],"time_class":"standard","visibility":"visible"},{"case_id":"c009","description":"Two distinct chars — two singletons","expected":{"literal":[1,1]},"input":{"s":"ab"},"tags":["edge"],"time_class":"standard","visibility":"visible"},{"case_id":"c010","description":"Long string — first 99 chars chained by repeating `a`, lone `z` is its own part","expected":{"literal":[99,1]},"input":{"s":"adcgbfebfbebbeicdgjgejbidccdicggefbbchedgfdihdgfihdjcehcfbhhgidhggfijfgbhgjidehbfccbhcdeibffiiideeaz"},"tags":["large"],"time_class":"large","visibility":"visible"}],"content_version":1,"entry":{"kind":"function","name":"partition_labels","params":[{"name":"s","type":"any"}],"returns":"any"},"schema":"test-definition/v1","slug":"partition-labels","track":"coding","validators":null,"variant":"javascript"}