{"cases":[{"case_id":"c000","description":"Empty tree → empty list of levels","expected":{"literal":[]},"input":{"root":{"entry":null,"nodes":[]}},"tags":["edge"],"time_class":"standard","visibility":"visible"},{"case_id":"c001","description":"Single node → one level with one value","expected":{"literal":[[1]]},"input":{"root":{"entry":0,"nodes":[{"fields":{"val":1},"id":0,"links":{"left":null,"right":null}}]}},"tags":["edge"],"time_class":"standard","visibility":"visible"},{"case_id":"c002","description":"Classic LeetCode example — three levels, missing children at level 2","expected":{"literal":[[3],[9,20],[15,7]]},"input":{"root":{"entry":0,"nodes":[{"fields":{"val":3},"id":0,"links":{"left":1,"right":2}},{"fields":{"val":9},"id":1,"links":{"left":null,"right":null}},{"fields":{"val":20},"id":2,"links":{"left":3,"right":4}},{"fields":{"val":15},"id":3,"links":{"left":null,"right":null}},{"fields":{"val":7},"id":4,"links":{"left":null,"right":null}}]}},"tags":["basic"],"time_class":"standard","visibility":"visible"},{"case_id":"c003","description":"Left-only chain — each level holds exactly one node","expected":{"literal":[[1],[2],[3],[4],[5]]},"input":{"root":{"entry":0,"nodes":[{"fields":{"val":1},"id":0,"links":{"left":1,"right":null}},{"fields":{"val":2},"id":1,"links":{"left":2,"right":null}},{"fields":{"val":3},"id":2,"links":{"left":3,"right":null}},{"fields":{"val":4},"id":3,"links":{"left":4,"right":null}},{"fields":{"val":5},"id":4,"links":{"left":null,"right":null}}]}},"tags":["edge"],"time_class":"standard","visibility":"visible"},{"case_id":"c004","description":"Right-only chain — each level holds exactly one node","expected":{"literal":[[1],[2],[3],[4],[5]]},"input":{"root":{"entry":0,"nodes":[{"fields":{"val":1},"id":0,"links":{"left":null,"right":1}},{"fields":{"val":2},"id":1,"links":{"left":null,"right":2}},{"fields":{"val":3},"id":2,"links":{"left":null,"right":3}},{"fields":{"val":4},"id":3,"links":{"left":null,"right":4}},{"fields":{"val":5},"id":4,"links":{"left":null,"right":null}}]}},"tags":["edge"],"time_class":"standard","visibility":"visible"},{"case_id":"c005","description":"Perfect binary tree of 7 nodes — three full levels","expected":{"literal":[[1],[2,3],[4,5,6,7]]},"input":{"root":{"entry":0,"nodes":[{"fields":{"val":1},"id":0,"links":{"left":1,"right":2}},{"fields":{"val":2},"id":1,"links":{"left":3,"right":4}},{"fields":{"val":3},"id":2,"links":{"left":5,"right":6}},{"fields":{"val":4},"id":3,"links":{"left":null,"right":null}},{"fields":{"val":5},"id":4,"links":{"left":null,"right":null}},{"fields":{"val":6},"id":5,"links":{"left":null,"right":null}},{"fields":{"val":7},"id":6,"links":{"left":null,"right":null}}]}},"tags":["basic"],"time_class":"standard","visibility":"visible"},{"case_id":"c006","description":"Tree with scattered nulls — left/right children skip around at each level","expected":{"literal":[[1],[2,3],[4,5],[6,7]]},"input":{"root":{"entry":0,"nodes":[{"fields":{"val":1},"id":0,"links":{"left":1,"right":2}},{"fields":{"val":2},"id":1,"links":{"left":3,"right":null}},{"fields":{"val":3},"id":2,"links":{"left":null,"right":4}},{"fields":{"val":4},"id":3,"links":{"left":5,"right":null}},{"fields":{"val":5},"id":4,"links":{"left":null,"right":6}},{"fields":{"val":6},"id":5,"links":{"left":null,"right":null}},{"fields":{"val":7},"id":6,"links":{"left":null,"right":null}}]}},"tags":["tricky"],"time_class":"standard","visibility":"visible"},{"case_id":"c007","description":"Asymmetric tree — deepest leaf reached via 1→2→5→7 only","expected":{"literal":[[1],[2,3],[4,5,6],[7]]},"input":{"root":{"entry":0,"nodes":[{"fields":{"val":1},"id":0,"links":{"left":1,"right":2}},{"fields":{"val":2},"id":1,"links":{"left":3,"right":4}},{"fields":{"val":3},"id":2,"links":{"left":null,"right":5}},{"fields":{"val":4},"id":3,"links":{"left":null,"right":null}},{"fields":{"val":5},"id":4,"links":{"left":6,"right":null}},{"fields":{"val":6},"id":5,"links":{"left":null,"right":null}},{"fields":{"val":7},"id":6,"links":{"left":null,"right":null}}]}},"tags":["tricky"],"time_class":"standard","visibility":"visible"},{"case_id":"c008","description":"Mixed-shape tree with interior nulls — order at each level must be left-to-right","expected":{"literal":[[5],[4,8],[11,13,4],[7,2,1]]},"input":{"root":{"entry":0,"nodes":[{"fields":{"val":5},"id":0,"links":{"left":1,"right":2}},{"fields":{"val":4},"id":1,"links":{"left":3,"right":null}},{"fields":{"val":8},"id":2,"links":{"left":4,"right":5}},{"fields":{"val":11},"id":3,"links":{"left":6,"right":7}},{"fields":{"val":13},"id":4,"links":{"left":null,"right":null}},{"fields":{"val":4},"id":5,"links":{"left":null,"right":8}},{"fields":{"val":7},"id":6,"links":{"left":null,"right":null}},{"fields":{"val":2},"id":7,"links":{"left":null,"right":null}},{"fields":{"val":1},"id":8,"links":{"left":null,"right":null}}]}},"tags":["tricky"],"time_class":"standard","visibility":"visible"},{"case_id":"c009","description":"Negative and zero values are preserved exactly","expected":{"literal":[[0],[-1,1],[-2,2]]},"input":{"root":{"entry":0,"nodes":[{"fields":{"val":0},"id":0,"links":{"left":1,"right":2}},{"fields":{"val":-1},"id":1,"links":{"left":3,"right":null}},{"fields":{"val":1},"id":2,"links":{"left":null,"right":4}},{"fields":{"val":-2},"id":3,"links":{"left":null,"right":null}},{"fields":{"val":2},"id":4,"links":{"left":null,"right":null}}]}},"tags":["edge"],"time_class":"standard","visibility":"visible"},{"case_id":"c010","description":"Perfect 4-level tree of 15 nodes — wide bottom level","expected":{"literal":[[10],[20,30],[40,50,60,70],[80,90,100,110,120,130,140,150]]},"input":{"root":{"entry":0,"nodes":[{"fields":{"val":10},"id":0,"links":{"left":1,"right":2}},{"fields":{"val":20},"id":1,"links":{"left":3,"right":4}},{"fields":{"val":30},"id":2,"links":{"left":5,"right":6}},{"fields":{"val":40},"id":3,"links":{"left":7,"right":8}},{"fields":{"val":50},"id":4,"links":{"left":9,"right":10}},{"fields":{"val":60},"id":5,"links":{"left":11,"right":12}},{"fields":{"val":70},"id":6,"links":{"left":13,"right":14}},{"fields":{"val":80},"id":7,"links":{"left":null,"right":null}},{"fields":{"val":90},"id":8,"links":{"left":null,"right":null}},{"fields":{"val":100},"id":9,"links":{"left":null,"right":null}},{"fields":{"val":110},"id":10,"links":{"left":null,"right":null}},{"fields":{"val":120},"id":11,"links":{"left":null,"right":null}},{"fields":{"val":130},"id":12,"links":{"left":null,"right":null}},{"fields":{"val":140},"id":13,"links":{"left":null,"right":null}},{"fields":{"val":150},"id":14,"links":{"left":null,"right":null}}]}},"tags":["large"],"time_class":"large","visibility":"visible"}],"content_version":1,"entry":{"kind":"tree","name":"level_order","params":[{"name":"root","type":"node"}]},"schema":"test-definition/v1","slug":"binary-tree-level-order-traversal","track":"coding","validators":null,"variant":"javascript"}