{"cases":[{"case_id":"c000","description":"Zero rolls — undefined stats","expected":{"literal":{"mean":null,"median":null,"mode":null}},"input":{"num_dice":1,"num_rolls":0,"seed":0,"sides":6},"tags":["edge"],"time_class":"standard","visibility":"visible"},{"case_id":"c001","description":"Zero dice — every sum is 0","expected":{"literal":{"mean":0,"median":0,"mode":0}},"input":{"num_dice":0,"num_rolls":5,"seed":0,"sides":6},"tags":["edge"],"time_class":"standard","visibility":"visible"},{"case_id":"c002","description":"One die with one side — always 1","expected":{"literal":{"mean":1,"median":1,"mode":1}},"input":{"num_dice":1,"num_rolls":1,"seed":0,"sides":1},"tags":["edge"],"time_class":"standard","visibility":"visible"},{"case_id":"c003","description":"Five rolls of a 1-sided die","expected":{"literal":{"mean":1,"median":1,"mode":1}},"input":{"num_dice":1,"num_rolls":5,"seed":42,"sides":1},"tags":["edge"],"time_class":"standard","visibility":"visible"}],"content_version":1,"entry":{"kind":"function","name":"simulate","params":[{"name":"num_dice","type":"any"},{"name":"num_rolls","type":"any"},{"name":"sides","type":"any"},{"name":"seed","type":"any"}],"returns":"any"},"schema":"test-definition/v1","slug":"dice-rolling-simulator-statistics","track":"coding","validators":null,"variant":"javascript"}