{"cases":[{"case_id":"c000","description":"Single edge — trivially a DAG","expected":{"literal":true},"input":{"num_courses":2,"prerequisites":[[1,0]]},"tags":["basic"],"time_class":"standard","visibility":"visible"},{"case_id":"c001","description":"Direct 2-cycle between courses 0 and 1","expected":{"literal":false},"input":{"num_courses":2,"prerequisites":[[1,0],[0,1]]},"tags":["basic"],"time_class":"standard","visibility":"visible"},{"case_id":"c002","description":"One course, no prereqs","expected":{"literal":true},"input":{"num_courses":1,"prerequisites":[]},"tags":["edge"],"time_class":"standard","visibility":"visible"},{"case_id":"c003","description":"Tree-shaped DAG rooted at 0","expected":{"literal":true},"input":{"num_courses":5,"prerequisites":[[1,0],[2,0],[3,1],[4,2]]},"tags":["basic"],"time_class":"standard","visibility":"visible"},{"case_id":"c004","description":"3-cycle 0 -> 1 -> 2 -> 0","expected":{"literal":false},"input":{"num_courses":3,"prerequisites":[[0,1],[1,2],[2,0]]},"tags":["tricky"],"time_class":"standard","visibility":"visible"},{"case_id":"c005","description":"Diamond-ish DAG — 2 has two parents, then 3 follows","expected":{"literal":true},"input":{"num_courses":4,"prerequisites":[[2,0],[2,1],[3,2]]},"tags":["basic"],"time_class":"standard","visibility":"visible"},{"case_id":"c006","description":"Zero courses — vacuously schedulable","expected":{"literal":true},"input":{"num_courses":0,"prerequisites":[]},"tags":["edge"],"time_class":"standard","visibility":"visible"},{"case_id":"c007","description":"Long chain 0 -> 1 -> 2 -> 3 -> 4 -> 5","expected":{"literal":true},"input":{"num_courses":6,"prerequisites":[[1,0],[2,1],[3,2],[4,3],[5,4]]},"tags":["tricky"],"time_class":"standard","visibility":"visible"}],"content_version":1,"entry":{"kind":"function","name":"can_finish","params":[{"name":"num_courses","type":"any"},{"name":"prerequisites","type":"any"}],"returns":"any"},"schema":"test-definition/v1","slug":"course-schedule","track":"coding","validators":null,"variant":"python"}