{"cases":[{"case_id":"c000","description":"Two-hop diamond — both paths length 2","expected":{"literal":2},"input":{"dest":"D","graph":{"A":["B","C"],"B":["D"],"C":["D"],"D":[]},"origin":"A"},"tags":["basic"],"time_class":"standard","visibility":"visible"},{"case_id":"c001","description":"Same node — distance 0","expected":{"literal":0},"input":{"dest":"A","graph":{"A":["B"],"B":[]},"origin":"A"},"tags":["edge"],"time_class":"standard","visibility":"visible"},{"case_id":"c002","description":"Disconnected","expected":{"literal":-1},"input":{"dest":"B","graph":{"A":[],"B":[]},"origin":"A"},"tags":["edge"],"time_class":"standard","visibility":"visible"},{"case_id":"c003","description":"Self-loop, self-target","expected":{"literal":0},"input":{"dest":"A","graph":{"A":["A"]},"origin":"A"},"tags":["edge"],"time_class":"standard","visibility":"visible"},{"case_id":"c004","description":"Cycle — must terminate via visited set","expected":{"literal":1},"input":{"dest":"B","graph":{"A":["B"],"B":["A"]},"origin":"A"},"tags":["tricky"],"time_class":"standard","visibility":"visible"},{"case_id":"c005","description":"Long chain — 99 hops","expected":{"literal":99},"input":{"dest":"P99","graph":{"P0":["P1"],"P1":["P2"],"P10":["P11"],"P11":["P12"],"P12":["P13"],"P13":["P14"],"P14":["P15"],"P15":["P16"],"P16":["P17"],"P17":["P18"],"P18":["P19"],"P19":["P20"],"P2":["P3"],"P20":["P21"],"P21":["P22"],"P22":["P23"],"P23":["P24"],"P24":["P25"],"P25":["P26"],"P26":["P27"],"P27":["P28"],"P28":["P29"],"P29":["P30"],"P3":["P4"],"P30":["P31"],"P31":["P32"],"P32":["P33"],"P33":["P34"],"P34":["P35"],"P35":["P36"],"P36":["P37"],"P37":["P38"],"P38":["P39"],"P39":["P40"],"P4":["P5"],"P40":["P41"],"P41":["P42"],"P42":["P43"],"P43":["P44"],"P44":["P45"],"P45":["P46"],"P46":["P47"],"P47":["P48"],"P48":["P49"],"P49":["P50"],"P5":["P6"],"P50":["P51"],"P51":["P52"],"P52":["P53"],"P53":["P54"],"P54":["P55"],"P55":["P56"],"P56":["P57"],"P57":["P58"],"P58":["P59"],"P59":["P60"],"P6":["P7"],"P60":["P61"],"P61":["P62"],"P62":["P63"],"P63":["P64"],"P64":["P65"],"P65":["P66"],"P66":["P67"],"P67":["P68"],"P68":["P69"],"P69":["P70"],"P7":["P8"],"P70":["P71"],"P71":["P72"],"P72":["P73"],"P73":["P74"],"P74":["P75"],"P75":["P76"],"P76":["P77"],"P77":["P78"],"P78":["P79"],"P79":["P80"],"P8":["P9"],"P80":["P81"],"P81":["P82"],"P82":["P83"],"P83":["P84"],"P84":["P85"],"P85":["P86"],"P86":["P87"],"P87":["P88"],"P88":["P89"],"P89":["P90"],"P9":["P10"],"P90":["P91"],"P91":["P92"],"P92":["P93"],"P93":["P94"],"P94":["P95"],"P95":["P96"],"P96":["P97"],"P97":["P98"],"P98":["P99"],"P99":[]},"origin":"P0"},"tags":["large"],"time_class":"large","visibility":"visible"}],"content_version":1,"entry":{"kind":"function","name":"recommendation_distance","params":[{"name":"graph","type":"any"},{"name":"origin","type":"any"},{"name":"dest","type":"any"}],"returns":"any"},"schema":"test-definition/v1","slug":"product-recommendation-distance","track":"coding","validators":null,"variant":"python"}