{"cases":[{"case_id":"c000","description":"Standard 5-word example","expected":{"matcher":"any_of","values":["wertf"]},"input":{"words":["wrt","wrf","er","ett","rftt"]},"tags":["basic"],"time_class":"standard","visibility":"visible"},{"case_id":"c001","description":"Two words, two characters","expected":{"matcher":"any_of","values":["zx"]},"input":{"words":["z","x"]},"tags":["basic"],"time_class":"standard","visibility":"visible"},{"case_id":"c002","description":"Cycle: z < x and x < z","expected":{"literal":""},"input":{"words":["z","x","z"]},"tags":["edge"],"time_class":"standard","visibility":"visible"},{"case_id":"c003","description":"Prefix violation — long word before its prefix","expected":{"literal":""},"input":{"words":["abc","ab"]},"tags":["edge"],"time_class":"standard","visibility":"visible"},{"case_id":"c004","description":"Single word — any permutation valid","expected":{"matcher":"any_of","values":["abc","acb","bac","bca","cab","cba"]},"input":{"words":["abc"]},"tags":["edge"],"time_class":"standard","visibility":"visible"},{"case_id":"c005","description":"Duplicate words — still must produce a < b","expected":{"matcher":"any_of","values":["ab"]},"input":{"words":["aa","aa","bb"]},"tags":["edge"],"time_class":"standard","visibility":"visible"}],"content_version":1,"entry":{"kind":"function","name":"alien_order","params":[{"name":"words","type":"any"}],"returns":"any"},"schema":"test-definition/v1","slug":"alien-dictionary","track":"coding","validators":null,"variant":"python"}