{"cases":[{"case_id":"c000","description":"Source data 001","expected":{"literal":2},"input":{"masses":[12]},"tags":["basic"],"time_class":"standard","visibility":"visible"},{"case_id":"c001","description":"Source example","expected":{"literal":2},"input":{"masses":[14]},"tags":["basic"],"time_class":"standard","visibility":"visible"},{"case_id":"c002","description":"Large example","expected":{"literal":654},"input":{"masses":[1969]},"tags":["basic"],"time_class":"standard","visibility":"visible"},{"case_id":"c003","description":"Largest source example","expected":{"literal":33583},"input":{"masses":[100756]},"tags":["basic"],"time_class":"standard","visibility":"visible"},{"case_id":"c004","description":"Multiple modules","expected":{"literal":34241},"input":{"masses":[12,14,1969,100756]},"tags":["edge"],"time_class":"standard","visibility":"visible"},{"case_id":"c005","description":"No modules","expected":{"literal":0},"input":{"masses":[]},"tags":["edge"],"time_class":"standard","visibility":"visible"}],"content_version":1,"entry":{"kind":"function","name":"rocket_fuel_sum","params":[{"name":"masses","type":"any"}],"returns":"any"},"schema":"test-definition/v1","slug":"rocket-equation-fuel-sum","track":"coding","validators":null,"variant":"python"}