{"cases":[{"case_id":"c000","description":"Classic LC example — interior region captured, border 'O' survives","expected":{"literal":[["X","X","X","X"],["X","X","X","X"],["X","X","X","X"],["X","O","X","X"]]},"input":{"board":[["X","X","X","X"],["X","O","O","X"],["X","X","O","X"],["X","O","X","X"]]},"tags":["basic"],"time_class":"standard","visibility":"visible"},{"case_id":"c001","description":"1x1 single 'X'","expected":{"literal":[["X"]]},"input":{"board":[["X"]]},"tags":["edge"],"time_class":"standard","visibility":"visible"},{"case_id":"c002","description":"1x1 single 'O' — entire cell is border, can't be surrounded","expected":{"literal":[["O"]]},"input":{"board":[["O"]]},"tags":["edge"],"time_class":"standard","visibility":"visible"},{"case_id":"c003","description":"All 'X' — nothing to flip","expected":{"literal":[["X","X","X"],["X","X","X"],["X","X","X"]]},"input":{"board":[["X","X","X"],["X","X","X"],["X","X","X"]]},"tags":["edge"],"time_class":"standard","visibility":"visible"},{"case_id":"c004","description":"All 'O' — every cell connects to the border","expected":{"literal":[["O","O","O"],["O","O","O"],["O","O","O"]]},"input":{"board":[["O","O","O"],["O","O","O"],["O","O","O"]]},"tags":["edge"],"time_class":"standard","visibility":"visible"},{"case_id":"c005","description":"Plus-shaped region with all four arms touching the border — fully safe","expected":{"literal":[["X","O","X"],["O","O","O"],["X","O","X"]]},"input":{"board":[["X","O","X"],["O","O","O"],["X","O","X"]]},"tags":["tricky"],"time_class":"standard","visibility":"visible"},{"case_id":"c006","description":"Single isolated 'O' fully surrounded — flipped","expected":{"literal":[["X","X","X"],["X","X","X"],["X","X","X"]]},"input":{"board":[["X","X","X"],["X","O","X"],["X","X","X"]]},"tags":["basic"],"time_class":"standard","visibility":"visible"},{"case_id":"c007","description":"Multiple regions — border 'O's survive, interior singletons flipped","expected":{"literal":[["X","O","X","X"],["O","X","X","X"],["X","X","X","O"],["X","X","O","X"]]},"input":{"board":[["X","O","X","X"],["O","X","O","X"],["X","O","X","O"],["X","X","O","X"]]},"tags":["tricky"],"time_class":"standard","visibility":"visible"},{"case_id":"c008","description":"2x2 interior block — fully captured","expected":{"literal":[["X","X","X","X"],["X","X","X","X"],["X","X","X","X"],["X","X","X","X"]]},"input":{"board":[["X","X","X","X"],["X","O","O","X"],["X","O","O","X"],["X","X","X","X"]]},"tags":["basic"],"time_class":"standard","visibility":"visible"},{"case_id":"c009","description":"Corner 'O's safe; interior 2x2 'O' block surrounded and flipped","expected":{"literal":[["O","X","X","O"],["X","X","X","X"],["X","X","X","X"],["O","X","X","O"]]},"input":{"board":[["O","X","X","O"],["X","O","O","X"],["X","O","O","X"],["O","X","X","O"]]},"tags":["tricky"],"time_class":"standard","visibility":"visible"}],"content_version":1,"entry":{"kind":"function","name":"solve","params":[{"name":"board","type":"any"}],"returns":"any"},"schema":"test-definition/v1","slug":"surrounded-regions","track":"coding","validators":null,"variant":"javascript"}