{"cases":[{"case_id":"c000","description":"Empty sentence","expected":{"literal":false},"input":{"sentence":""},"tags":["edge"],"time_class":"standard","visibility":"visible"},{"case_id":"c001","description":"Perfect lowercase pangram","expected":{"literal":true},"input":{"sentence":"abcdefghijklmnopqrstuvwxyz"},"tags":["basic"],"time_class":"standard","visibility":"visible"},{"case_id":"c002","description":"Classic pangram","expected":{"literal":true},"input":{"sentence":"the quick brown fox jumps over the lazy dog"},"tags":["basic"],"time_class":"standard","visibility":"visible"},{"case_id":"c003","description":"Missing x","expected":{"literal":false},"input":{"sentence":"a quick movement of the enemy will jeopardize five gunboats"},"tags":["basic"],"time_class":"standard","visibility":"visible"},{"case_id":"c004","description":"Underscores ignored","expected":{"literal":true},"input":{"sentence":"the_quick_brown_fox_jumps_over_the_lazy_dog"},"tags":["edge"],"time_class":"standard","visibility":"visible"},{"case_id":"c005","description":"Numbers ignored","expected":{"literal":true},"input":{"sentence":"the 1 quick brown fox jumps over the 2 lazy dogs"},"tags":["edge"],"time_class":"standard","visibility":"visible"},{"case_id":"c006","description":"Numbers do not substitute for letters","expected":{"literal":false},"input":{"sentence":"7h3 qu1ck brown fox jumps ov3r 7h3 lazy dog"},"tags":["tricky"],"time_class":"standard","visibility":"visible"},{"case_id":"c007","description":"Mixed case and punctuation","expected":{"literal":true},"input":{"sentence":"\"Five quacking Zephyrs jolt my wax bed.\""},"tags":["tricky"],"time_class":"standard","visibility":"visible"}],"content_version":1,"entry":{"kind":"function","name":"is_pangram","params":[{"name":"sentence","type":"any"}],"returns":"any"},"schema":"test-definition/v1","slug":"pangram-detector","track":"coding","validators":null,"variant":"javascript"}