{"cases":[{"case_id":"c000","description":"Two valid answers","expected":{"validator_id":"v-d39d326f3f08"},"input":{"s":"babad"},"tags":["basic"],"time_class":"standard","visibility":"visible"},{"case_id":"c001","description":"Even-length palindrome","expected":{"literal":"bb"},"input":{"s":"cbbd"},"tags":["basic"],"time_class":"standard","visibility":"visible"},{"case_id":"c002","description":"Empty string","expected":{"literal":""},"input":{"s":""},"tags":["edge"],"time_class":"standard","visibility":"visible"},{"case_id":"c003","description":"Single char","expected":{"literal":"a"},"input":{"s":"a"},"tags":["edge"],"time_class":"standard","visibility":"visible"},{"case_id":"c004","description":"Long even-length palindrome embedded mid-string","expected":{"literal":"geeksskeeg"},"input":{"s":"forgeeksskeegfor"},"tags":["tricky"],"time_class":"standard","visibility":"visible"},{"case_id":"c005","description":"All identical — entire string","expected":{"literal":"aaaa"},"input":{"s":"aaaa"},"tags":["edge"],"time_class":"standard","visibility":"visible"},{"case_id":"c006","description":"All distinct — any single char","expected":{"validator_id":"v-d39d326f3f08"},"input":{"s":"abc"},"tags":["edge"],"time_class":"standard","visibility":"visible"}],"content_version":1,"entry":{"kind":"function","name":"longest_palindrome","params":[{"name":"s","type":"any"}],"returns":"any"},"schema":"test-definition/v1","slug":"longest-palindromic-substring","track":"coding","validators":{"checksum":"sha256:bdb8e5e655cd4ffe88307813a7a0510b18958522d4d902001a8244ad70f641e8","content_version":1,"slug":"longest-palindromic-substring"},"variant":"python"}