{"cases":[{"case_id":"c000","description":"One step — only one way","expected":{"literal":1},"input":{"n":1},"tags":["edge"],"time_class":"standard","visibility":"visible"},{"case_id":"c001","description":"Two ways — 1+1 or 2","expected":{"literal":2},"input":{"n":2},"tags":["basic"],"time_class":"standard","visibility":"visible"},{"case_id":"c002","description":"Three ways — 1+1+1, 1+2, 2+1","expected":{"literal":3},"input":{"n":3},"tags":["basic"],"time_class":"standard","visibility":"visible"},{"case_id":"c003","description":"Fibonacci continues — 5 distinct paths","expected":{"literal":5},"input":{"n":4},"tags":["basic"],"time_class":"standard","visibility":"visible"},{"case_id":"c004","description":"8 distinct paths","expected":{"literal":8},"input":{"n":5},"tags":["basic"],"time_class":"standard","visibility":"visible"},{"case_id":"c005","description":"Mid-range — 89 ways","expected":{"literal":89},"input":{"n":10},"tags":["tricky"],"time_class":"standard","visibility":"visible"},{"case_id":"c006","description":"Larger n — exponential growth visible","expected":{"literal":10946},"input":{"n":20},"tags":["tricky"],"time_class":"standard","visibility":"visible"},{"case_id":"c007","description":"Upper bound — verifies the full Fibonacci ramp without int overflow","expected":{"literal":1836311903},"input":{"n":45},"tags":["large"],"time_class":"large","visibility":"visible"}],"content_version":1,"entry":{"kind":"function","name":"climb_stairs","params":[{"name":"n","type":"any"}],"returns":"any"},"schema":"test-definition/v1","slug":"climbing-stairs","track":"coding","validators":null,"variant":"javascript"}