{"cases":[{"case_id":"c000","description":"Standard sequence","expected":{"literal":[null,null,null,"A","B",null]},"input":{"args":[[],[10,"A"],[20,"B"],[15],[20],[5]],"ops":["DateMap","set","set","get","get","get"]},"tags":["basic"],"time_class":"standard","visibility":"visible"},{"case_id":"c001","description":"Empty map — get returns None","expected":{"literal":[null,null]},"input":{"args":[[],[100]],"ops":["DateMap","get"]},"tags":["edge"],"time_class":"standard","visibility":"visible"},{"case_id":"c002","description":"Repeated set on same key replaces","expected":{"literal":[null,null,null,"new"]},"input":{"args":[[],[5,"old"],[5,"new"],[5]],"ops":["DateMap","set","set","get"]},"tags":["edge"],"time_class":"standard","visibility":"visible"},{"case_id":"c003","description":"Above max returns latest; below min returns None","expected":{"literal":[null,null,"A",null]},"input":{"args":[[],[10,"A"],[10000],[-1]],"ops":["DateMap","set","get","get"]},"tags":["edge"],"time_class":"standard","visibility":"visible"},{"case_id":"c004","description":"Mixed gets across the range","expected":{"literal":[null,null,null,null,null,null,"v10","v20","v50","v50",null,"v40"]},"input":{"args":[[],[10,"v10"],[20,"v20"],[30,"v30"],[40,"v40"],[50,"v50"],[10],[25],[50],[55],[9],[40]],"ops":["DateMap","set","set","set","set","set","get","get","get","get","get","get"]},"tags":["basic"],"time_class":"standard","visibility":"visible"}],"content_version":1,"entry":{"class":"DateMap","constructor":{"params":[]},"kind":"class_ops","methods":[{"name":"set","params":[{"name":"key","type":"int"},{"name":"value","type":"any"}],"returns":"any"},{"name":"get","params":[{"name":"key","type":"int"}],"returns":"any"}]},"schema":"test-definition/v1","slug":"date-map-floor-key-lookup","track":"coding","validators":null,"variant":"python"}