{"cases":[{"case_id":"c000","description":"Classic LC example — path 1 → 2 → 6 → 9","expected":{"literal":4},"input":{"matrix":[[9,9,4],[6,6,8],[2,1,1]]},"tags":["basic"],"time_class":"standard","visibility":"visible"},{"case_id":"c001","description":"Second LC example — path 3 → 4 → 5 → 6 (no diagonals)","expected":{"literal":4},"input":{"matrix":[[3,4,5],[3,2,6],[2,2,1]]},"tags":["basic"],"time_class":"standard","visibility":"visible"},{"case_id":"c002","description":"Single cell — trivial path of length 1","expected":{"literal":1},"input":{"matrix":[[1]]},"tags":["edge"],"time_class":"standard","visibility":"visible"},{"case_id":"c003","description":"All-equal — strict increase forbids any move; length 1","expected":{"literal":1},"input":{"matrix":[[7,7,7],[7,7,7],[7,7,7]]},"tags":["edge"],"time_class":"standard","visibility":"visible"},{"case_id":"c004","description":"Single ascending row — full row is the path","expected":{"literal":5},"input":{"matrix":[[1,2,3,4,5]]},"tags":["basic"],"time_class":"standard","visibility":"visible"},{"case_id":"c005","description":"Single ascending column — full column is the path","expected":{"literal":5},"input":{"matrix":[[1],[2],[3],[4],[5]]},"tags":["basic"],"time_class":"standard","visibility":"visible"},{"case_id":"c006","description":"Spiral pattern — entire grid is one increasing path of length 16","expected":{"literal":16},"input":{"matrix":[[1,2,3,4],[12,13,14,5],[11,16,15,6],[10,9,8,7]]},"tags":["tricky"],"time_class":"standard","visibility":"visible"},{"case_id":"c007","description":"Decreasing toward bottom-right — path 1 → 2 → 3 → 4 → 5","expected":{"literal":5},"input":{"matrix":[[5,4,3],[4,3,2],[3,2,1]]},"tags":["tricky"],"time_class":"standard","visibility":"visible"},{"case_id":"c008","description":"2x2 — path 1 → 2 → 3 → 4 walks around the cells","expected":{"literal":4},"input":{"matrix":[[1,2],[4,3]]},"tags":["basic"],"time_class":"standard","visibility":"visible"},{"case_id":"c009","description":"1x1 with zero — length 1","expected":{"literal":1},"input":{"matrix":[[0]]},"tags":["edge"],"time_class":"standard","visibility":"visible"}],"content_version":1,"entry":{"kind":"function","name":"longest_increasing_path","params":[{"name":"matrix","type":"any"}],"returns":"any"},"schema":"test-definition/v1","slug":"longest-increasing-path-in-a-matrix","track":"coding","validators":null,"variant":"python"}