{"cases":[{"case_id":"c000","description":"Three meetings, max overlap of 2","expected":{"literal":2},"input":{"intervals":[[0,30],[5,10],[15,20]]},"tags":["basic"],"time_class":"standard","visibility":"visible"},{"case_id":"c001","description":"Disjoint","expected":{"literal":1},"input":{"intervals":[[7,10],[2,4]]},"tags":["basic"],"time_class":"standard","visibility":"visible"},{"case_id":"c002","description":"Empty","expected":{"literal":0},"input":{"intervals":[]},"tags":["edge"],"time_class":"standard","visibility":"visible"},{"case_id":"c003","description":"Single meeting","expected":{"literal":1},"input":{"intervals":[[1,5]]},"tags":["edge"],"time_class":"standard","visibility":"visible"},{"case_id":"c004","description":"Touching at endpoint — share room","expected":{"literal":1},"input":{"intervals":[[1,5],[5,10]]},"tags":["tricky"],"time_class":"standard","visibility":"visible"},{"case_id":"c005","description":"Three identical — three rooms","expected":{"literal":3},"input":{"intervals":[[0,10],[0,10],[0,10]]},"tags":["edge"],"time_class":"standard","visibility":"visible"},{"case_id":"c006","description":"Back-to-back, sharing one room","expected":{"literal":1},"input":{"intervals":[[0,5],[5,10],[10,15],[15,20],[20,25],[25,30],[30,35],[35,40],[40,45],[45,50],[50,55],[55,60],[60,65],[65,70],[70,75],[75,80],[80,85],[85,90],[90,95],[95,100]]},"tags":["basic"],"time_class":"standard","visibility":"visible"}],"content_version":1,"entry":{"kind":"function","name":"min_meeting_rooms","params":[{"name":"intervals","type":"any"}],"returns":"any"},"schema":"test-definition/v1","slug":"minimum-meeting-rooms","track":"coding","validators":null,"variant":"javascript"}