{"cases":[{"case_id":"c000","description":"Canonical case — bars [5,6] at height 5 give area 10","expected":{"literal":10},"input":{"heights":[2,1,5,6,2,3]},"tags":["basic"],"time_class":"standard","visibility":"visible"},{"case_id":"c001","description":"Two bars — either the full strip at height 2 or the lone 4","expected":{"literal":4},"input":{"heights":[2,4]},"tags":["basic"],"time_class":"standard","visibility":"visible"},{"case_id":"c002","description":"Empty histogram — no rectangle possible","expected":{"literal":0},"input":{"heights":[]},"tags":["edge"],"time_class":"standard","visibility":"visible"},{"case_id":"c003","description":"Single bar — area equals its height","expected":{"literal":5},"input":{"heights":[5]},"tags":["edge"],"time_class":"standard","visibility":"visible"},{"case_id":"c004","description":"Flat histogram — full width at height 1","expected":{"literal":3},"input":{"heights":[1,1,1]},"tags":["edge"],"time_class":"standard","visibility":"visible"},{"case_id":"c005","description":"Best rectangle is bars [5,4,5] at height 4, width 3 — area 12","expected":{"literal":12},"input":{"heights":[6,2,5,4,5,1,6]},"tags":["tricky"],"time_class":"standard","visibility":"visible"},{"case_id":"c006","description":"All zeros — no positive area","expected":{"literal":0},"input":{"heights":[0,0,0]},"tags":["edge"],"time_class":"standard","visibility":"visible"},{"case_id":"c007","description":"Strictly decreasing — best is height 3 over width 3 (or 2x4, 1x5); 9 wins","expected":{"literal":9},"input":{"heights":[5,4,3,2,1]},"tags":["tricky"],"time_class":"standard","visibility":"visible"}],"content_version":1,"entry":{"kind":"function","name":"largest_rectangle_area","params":[{"name":"heights","type":"any"}],"returns":"any"},"schema":"test-definition/v1","slug":"largest-rectangle-in-histogram","track":"coding","validators":null,"variant":"javascript"}