{"cases":[{"case_id":"c000","description":"Three groups","expected":{"matcher":"unordered_deep","value":[["aab","xxy"],["xyy"],["abc","def"]]},"input":{"words":["aab","xxy","xyy","abc","def"]},"tags":["basic"],"time_class":"standard","visibility":"visible"},{"case_id":"c001","description":"Empty input","expected":{"literal":[]},"input":{"words":[]},"tags":["edge"],"time_class":"standard","visibility":"visible"},{"case_id":"c002","description":"Single word","expected":{"literal":[["a"]]},"input":{"words":["a"]},"tags":["edge"],"time_class":"standard","visibility":"visible"},{"case_id":"c003","description":"All distinct-char 2-letter words → same signature [0,1]","expected":{"matcher":"unordered_deep","value":[["ab","cd","ef"]]},"input":{"words":["ab","cd","ef"]},"tags":["edge"],"time_class":"standard","visibility":"visible"},{"case_id":"c004","description":"Classic isomorphic pair","expected":{"matcher":"unordered_deep","value":[["paper","title"]]},"input":{"words":["paper","title"]},"tags":["basic"],"time_class":"standard","visibility":"visible"},{"case_id":"c005","description":"Different lengths → different groups","expected":{"matcher":"unordered_deep","value":[["a"],["bb"]]},"input":{"words":["a","bb"]},"tags":["edge"],"time_class":"standard","visibility":"visible"}],"content_version":1,"entry":{"kind":"function","name":"group_isomorphic","params":[{"name":"words","type":"any"}],"returns":"any"},"schema":"test-definition/v1","slug":"group-isomorphic-words","track":"coding","validators":null,"variant":"python"}