{"cases":[{"case_id":"c000","description":"LeetCode 460 classic example","expected":{"literal":[null,null,null,1,null,-1,3,null,-1,3,4]},"input":{"args":[[2],[1,1],[2,2],[1],[3,3],[2],[3],[4,4],[1],[3],[4]],"ops":["LFUCache","put","put","get","put","get","get","put","get","get","get"]},"tags":["basic"],"time_class":"standard","visibility":"visible"},{"case_id":"c001","description":"Capacity 0 — every put is a no-op, every get returns -1","expected":{"literal":[null,null,-1]},"input":{"args":[[0],[0,0],[0]],"ops":["LFUCache","put","get"]},"tags":["edge"],"time_class":"standard","visibility":"visible"},{"case_id":"c002","description":"Capacity 1 — every put after the first evicts","expected":{"literal":[null,null,1,null,-1,2]},"input":{"args":[[1],[1,1],[1],[2,2],[1],[2]],"ops":["LFUCache","put","get","put","get","get"]},"tags":["edge"],"time_class":"standard","visibility":"visible"},{"case_id":"c003","description":"Many puts no gets — frequencies all equal, LRU breaks ties","expected":{"literal":[null,null,null,null,null,null]},"input":{"args":[[3],[1,1],[2,2],[3,3],[4,4],[5,5]],"ops":["LFUCache","put","put","put","put","put"]},"tags":["basic"],"time_class":"standard","visibility":"visible"},{"case_id":"c004","description":"Missing key returns -1; absent gets do not affect frequencies","expected":{"literal":[null,-1,null,-1,1]},"input":{"args":[[2],[99],[1,1],[99],[1]],"ops":["LFUCache","get","put","get","get"]},"tags":["edge"],"time_class":"standard","visibility":"visible"},{"case_id":"c005","description":"Eviction by frequency — key 2 with freq 1 is evicted, key 1 (freq 3) survives","expected":{"literal":[null,null,null,10,10,null,-1,10]},"input":{"args":[[2],[1,10],[2,20],[1],[1],[3,30],[2],[1]],"ops":["LFUCache","put","put","get","get","put","get","get"]},"tags":["basic"],"time_class":"standard","visibility":"visible"},{"case_id":"c006","description":"Tie-break LRU — keys 1 and 3 both have freq 1 after the get(2); 1 is older","expected":{"literal":[null,null,null,null,2,null,-1,3,4]},"input":{"args":[[3],[1,1],[2,2],[3,3],[2],[4,4],[1],[3],[4]],"ops":["LFUCache","put","put","put","get","put","get","get","get"]},"tags":["basic"],"time_class":"standard","visibility":"visible"},{"case_id":"c007","description":"Large mixed — put(4) evicts key 1 (lowest freq, LRU). After gets 4,3,2 the freq-2 bucket holds {4,3,2} in touch-order. put(5) evicts the LRU of the lowest non-empty freq bucket: minFreq is now 2 (bucket 1 emptied), and key 4 is the LRU of bucket 2. So key 4 is evicted; final cache = {2,3,5}.","expected":{"literal":[null,null,null,null,null,4,3,2,-1,null,-1,2,3,-1,5]},"input":{"args":[[3],[1,1],[2,2],[3,3],[4,4],[4],[3],[2],[1],[5,5],[1],[2],[3],[4],[5]],"ops":["LFUCache","put","put","put","put","get","get","get","get","put","get","get","get","get","get"]},"tags":["large","mixed"],"time_class":"large","visibility":"visible"}],"content_version":1,"entry":{"class":"LFUCache","constructor":{"params":[{"name":"capacity","type":"int"}]},"kind":"class_ops","methods":[{"name":"get","params":[{"name":"key","type":"int"}],"returns":"int"},{"name":"put","params":[{"name":"key","type":"int"},{"name":"value","type":"int"}],"returns":"any"}]},"schema":"test-definition/v1","slug":"lfu-cache","track":"coding","validators":null,"variant":"javascript"}